IDEP 2023;;;;;;;;IDEP;;METAS;
Cod_Esc;Escola;Diretoria;Distrito;NSE;Grupo;ICG;Faixa;IDEP_INICIAL;IDEP_FINAL;IDEP_INICIAL;IDEP_FINAL
92762;EMEF JOAO XXIII;BUTANTA;RAPOSO TAVARES;49,81640282;2;6;4;4;2,3;4,5;3,9
94196;EMEF ERICO VERISSIMO;FREGUESIA/BRASILANDIA;FREGUESIA DO O;50,00111797;2;3;3;4,4;2,7;4,6;3,6
94269;EMEF CASTRO ALVES;FREGUESIA/BRASILANDIA;BRASILANDIA;46,35954027;1;5;2;4,1;2,7;3,7;3,5
94315;EMEF PEDRO AMERICO;FREGUESIA/BRASILANDIA;FREGUESIA DO O;46,12330621;1;3;1;4,4;2,8;3,8;3,0
19351;EMEF MARILI DIAS, PROFA;PIRITUBA;ANHANGUERA;48,57506222;1;3;1;4,1;2,9;4,5;3,9
19384;CEU EMEF PARAISOPOLIS;CAMPO LIMPO;VILA ANDRADE;47,66445672;1;3;1;3,8;3,0;3,7;3,5
94340;EMEF AROLDO DE AZEVEDO, PROF.;FREGUESIA/BRASILANDIA;LIMAO;50,49885876;2;5;4;4,4;3,0;3,3;3,5
15024;EMEF CAIO SERGIO POMPEU DE TOLEDO, DEP.;GUAIANASES;CIDADE TIRADEN;49,10249657;1;3;1;4,8;3,2;3,8;2,9
19221;EMEF JARDIM DAS LARANJEIRAS;SAO MATEUS;IGUATEMI;49,32155318;1;3;1;5;3,2;4,9;4,4
13528;EMEF ANNA LAMBERGA ZEGLIO, VER.;GUAIANASES;CIDADE TIRADEN;48,74016398;1;6;2;3,6;3,3;3,9;3,1
14583;EMEF FLAVIO AUGUSTO ROSA, PROF.;SAO MIGUEL;JARDIM HELENA;49,27875601;1;3;1;4,2;3,3;4,2;3,0
19422;EMEF M BOI MIRIM I;CAMPO LIMPO;JARDIM SAO LUI;48,69303992;1;3;1;4,9;3,3;4,6;4,0
94277;EMEF JOAO AMOS COMENIUS;FREGUESIA/BRASILANDIA;BRASILANDIA;47,22392962;1;3;1;3,5;3,3;3,1;3,0
94358;EMEF ANGELINA MAFFEI VITA, DA.;FREGUESIA/BRASILANDIA;CASA VERDE;48,50794947;1;5;2;4,4;3,3;4,4;3,7
99783;EMEF GERALDO SESSO JUNIOR;FREGUESIA/BRASILANDIA;BRASILANDIA;47,27869356;1;3;1;3,4;3,3;4,0;2,9
191;EMEF ALIPIO CORREA NETO, PROF.;BUTANTA;VILA SONIA;49,3158978;1;3;1;4,4;3,4;4,9;3,9
19704;EMEF PRIMO PASCOLI MELARE, PROF.;FREGUESIA/BRASILANDIA;BRASILANDIA;48,85483203;1;6;2;4,1;3,4;3,6;3,0
94625;EMEF CAXIAS, DUQUE DE;IPIRANGA;SE;47,66207512;1;6;2;4,1;3,4;3,6;3,4
95257;EMEF ANTONIO DE SAMPAIO DORIA, PROF.;SANTO AMARO;CIDADE ADEMAR;49,85906656;2;6;4;4;3,4;3,7;2,9
97721;EMEF JOSE AUGUSTO CESAR SALGADO, DR.;GUAIANASES;CIDADE TIRADEN;50,20174498;2;3;3;4;3,4;4,2;3,5
10154;EMEF MAURO FACCIO GONCALVES - ZACARIA;CAMPO LIMPO;JARDIM SAO LUI;50,43790683;2;5;4;4,9;3,5;4,9;3,1
18511;EMEF CARLOS CORREA MASCARO, PROF.;SAO MATEUS;IGUATEMI;50,44284772;2;3;3;4,8;3,5;4,4;4,2
19046;EMEF CELIA REGINA LEKEVICIUS CONSOLIN, PROFA.;JACANA/TREMEMBE;VILA MARIA;50,02834346;2;3;3;3,6;3,5;4,3;3,1
92819;EMEF BRASIL-JAPAO;BUTANTA;RIO PEQUENO;50,81153404;2;5;4;4,1;3,5;3,8;2,5
94200;EMEF MILTOM CAMPOS, SEN.;FREGUESIA/BRASILANDIA;BRASILANDIA;50,48803078;2;5;4;3,6;3,5;3,7;2,5
94382;EMEF CECILIA MORAES DE VASCONCELOS, PROFA.;FREGUESIA/BRASILANDIA;BRASILANDIA;47,32531205;1;6;2;3,5;3,5;4,0;3,0
94463;EMEF LEONEL FRANCA, PE.;PIRITUBA;JARAGUA;48,99236676;1;6;2;3,8;3,5;3,7;2,6
94803;EMEF ARY GOMES, CEL.;JACANA/TREMEMBE;VILA MARIA;48,44341762;1;3;1;3,3;3,5;3,5;2,6
94889;EMEF ANTONIO SANT ANA GALVAO, FREI;JACANA/TREMEMBE;JACANA;51,12777666;2;3;3;4;3,5;3,2;2,4
95222;EMEF ARY PARREIRAS, ALM.;SANTO AMARO;JABAQUARA;55,52549036;3;3;5;3,2;3,5;3,4;2,5
95362;EMEF MAUA, BR. DE;PENHA;AGUA RASA;48,93096292;1;5;2;4,8;3,5;4,6;4,8
95524;EMEF VINICIUS DE MORAES;SAO MATEUS;SAPOPEMBA;54,46889884;3;3;5;4,3;3,5;4,0;3,3
99261;EMEF TEOFILO BENEDITO OTTONI;BUTANTA;RAPOSO TAVARES;51,62196434;2;3;3;5,4;3,5;5,3;5,2
19488;EMEF PAULO CARNEIRO THOMAZ ALVES, GEN.;JACANA/TREMEMBE;VILA MARIA;50,38702296;2;6;4;3,2;3,6;3,1;2,9
93955;EMEF JACKSON DE FIGUEIREDO;PENHA;TATUAPE;52,57505071;3;5;6;5,0;3,6;5,3;4,2
94447;EMEF RENATO ANTONIO CHECCHIA, PROF.;PIRITUBA;PIRITUBA;47,39140497;1;5;2;4,6;3,6;3,5;2,3
94773;EMEF OLIVA IRENE BAYERLEIN SILVA;JACANA/TREMEMBE;VILA GUILHERME;51,46015445;2;3;3;3,9;3,6;4,8;4,6
95532;EMEF RODRIGUES DE CARVALHO;SAO MATEUS;SAPOPEMBA;49,84365391;2;3;3;4,2;3,6;4,0;3,7
11924;EMEF MARIA ALICE BORGES GHION, PROFA.;BUTANTA;RAPOSO TAVARES;52,38447288;3;5;6;4,9;3,7;4,8;3,6
13803;EMEF JULIO DE GRAMMONT;SAO MATEUS;SAO RAFAEL;48,78983516;1;6;2;4,4;3,7;3,5;2,8
17523;EMEF CLOTILDE ROSA HENRIQUES ELIAS, PROFA.;ITAQUERA;JOSE BONIFACIO;49,04215815;1;3;1;4,7;3,7;4,4;3,4
19223;EMEF MARIA APARECIDA VILASBOAS, PROFA.;SAO MATEUS;SAO RAFAEL;47,97108623;1;3;1;4,2;3,7;4,3;4,0
19322;EMEF CITY JARAGUA IV;PIRITUBA;JARAGUA;46,48368158;1;3;1;4,3;3,7;4,3;3,0
92843;EMEF ROBERTO MANGE, PROF.;BUTANTA;RIO PEQUENO;48,40443855;1;3;1;3,7;3,7;3,4;3,0
93335;EMEF JOAO DE DEUS CARDOSO DE MELLO;CAPELA DO SOCORRO;CIDADE DUTRA;50,46025574;2;6;4;4;3,7;4,8;4,3
93432;EMEF CORREIA DE MELLO, BRIG.;ITAQUERA;CIDADE LIDER;49,41358831;2;3;3;5,1;3,7;4,1;3,2
93653;EMEF VLADIMIR HERZOG;GUAIANASES;CIDADE TIRADEN;49,27063617;1;3;1;4,2;3,7;4,4;3,2
94145;EMEF EDGARD CAVALHEIRO;PENHA;CANGAIBA;50,30644636;2;6;4;4,9;3,7;4,3;3,5
94170;EMEF PLINIO AYROSA;FREGUESIA/BRASILANDIA;FREGUESIA DO O;50,97944422;2;3;3;4,4;3,7;4,3;4,2
94668;EMEFM DERVILLE ALLEGRETTI, PROF.;JACANA/TREMEMBE;SANTANA;50,39343577;2;4;4;3,4;3,7;3,4;3,4
9156;EMEF LUIS CARLOS PRESTES, SEN.;GUAIANASES;CIDADE TIRADEN;52,86160874;3;5;6;3,8;3,8;-;3,8
19220;EMEF MARIO LAGO;PIRITUBA;JARAGUA;48,97664112;1;6;2;3,7;3,8;3,8;2,8
19222;EMEF VEREMUNDO TOTH, DOM;CAMPO LIMPO;VILA ANDRADE;48,49057708;1;6;2;4,4;3,8;3,8;2,8
19410;EMEF MURURES;SAO MIGUEL;JARDIM HELENA;47,24535322;1;3;1;3,7;3,8;4,4;3,7
19428;EMEF SOCRATES BRASILEIRO SAMPAIO DE SOUSA VIEIRA DE OLIVEIRA;CAMPO LIMPO;CAMPO LIMPO;49,18707605;1;5;2;4,2;3,8;4,2;3,0
19445;EMEF ROGE FERREIRA, DEP.;PIRITUBA;JARAGUA;51,55349374;2;3;3;4,2;3,8;4,8;4,5
19466;EMEF PERIMETRAL;CAMPO LIMPO;VILA ANDRADE;47,88787887;1;6;2;4,1;3,8;4,0;2,9
19480;EMEF ABRAO HUCK, DR.;IPIRANGA;SACOMA;48,23124595;1;3;1;5,2;3,8;4,2;3,5
92835;EMEF ESPIRIDIAO ROSAS, MAL.;PIRITUBA;JAGUARE;49,06790252;1;6;2;4,3;3,8;4,3;2,8
92975;EMEF OTONIEL MOTA;CAMPO LIMPO;JARDIM SAO LUI;48,39710936;1;5;2;3,8;3,8;4,1;3,3
93238;EMEF ANTENOR NASCENTES;SANTO AMARO;CAMPO GRANDE;50,94607211;2;3;3;4,1;3,8;4,2;3,9
93254;EMEF JOAO SUSSUMU HIRATA, DEP.;SANTO AMARO;PEDREIRA;48,16438088;1;6;2;5,2;3,8;4,0;3,7
93262;EMEF ISABEL VIEIRA FERREIRA, PROFA.;SANTO AMARO;PEDREIRA;49,49434105;2;3;3;4,4;3,8;4,2;3,5
93548;EMEF SATURNINO PEREIRA;GUAIANASES;CIDADE TIRADEN;48,60147723;1;6;2;3,5;3,8;3,8;2,8
93751;EMEF PAULO ROLIM LOUREIRO, D.;SAO MIGUEL;SAO MIGUEL;50,86606121;2;6;4;3,9;3,8;4,4;4,2
94111;EMEF LUIS WASHINGTON VITA;PENHA;PONTE RASA;51,81031258;3;5;6;4,8;3,8;4,3;3,7
94854;EMEF ENEAS CARVALHO DE AGUIAR;JACANA/TREMEMBE;VILA MEDEIROS;47,62783309;1;3;1;4,6;3,8;4,0;3,4
95036;EMEF LEAO MACHADO, PROF.;IPIRANGA;SACOMA;53,18799345;3;5;6;5,1;3,8;5,3;5,1
95249;EMEF HABIB CARLOS KYRILLOS, DR.;SANTO AMARO;CIDADE ADEMAR;50,40088454;2;3;3;4,2;3,8;4,6;4,1
97705;EMEF AURELIANO LEITE;GUAIANASES;CIDADE TIRADEN;48,80211218;1;3;1;3,5;3,8;4,6;4,0
264;EMEF SYLVIO HECK, ALM.;SANTO AMARO;PEDREIRA;46,62633844;1;3;1;4,7;3,9;3,9;3,4
477;EMEF EDA TEREZINHA CHICA MEDEIROS, PROFA.;BUTANTA;RAPOSO TAVARES;48,44357198;1;3;1;3,6;3,9;4,2;3,5
11533;EMEF FRANCISCO DA SILVEIRA BUENO, PROF.;IPIRANGA;SAO LUCAS;43,88935403;1;3;1;3,8;3,9;3,0;2,9
17973;EMEF MAILSON DELANE, PROF.;GUAIANASES;CIDADE TIRADEN;49,11600186;1;6;2;4,1;3,9;3,5;3,5
19341;EMEF JARDIM GUARANI - JOSE ALFREDO APOLINARIO, PROF.;FREGUESIA/BRASILANDIA;BRASILANDIA;48,57590396;1;3;1;4,2;3,9;3,9;3,9
19363;CEU EMEF JARDIM PAULISTANO;FREGUESIA/BRASILANDIA;BRASILANDIA;48,31220147;1;3;1;4,4;3,9;4,2;4,0
19405;EMEF GILBERTO DUPAS, PROF;FREGUESIA/BRASILANDIA;CACHOEIRINHA;50,33857962;2;3;3;4,1;3,9;3,8;3,6
19412;EMEF BADRA;PIRITUBA;PERUS;47,82576196;1;5;2;5,2;3,9;4,2;3,1
92681;EMEF JOSE DE ALCANTARA MACHADO FILHO;BUTANTA;MORUMBI;47,69282798;1;5;2;3,7;3,9;3,0;2,7
94536;EMEF JAIRO RAMOS;PIRITUBA;SAO DOMINGOS;49,56441465;2;5;4;4,1;3,9;4,5;3,8
299;EMEF ROBERTO PATRICIO, PROF.;FREGUESIA/BRASILANDIA;CACHOEIRINHA;52,7577122;3;3;5;4,8;4,0;5,3;5,1
10120;EMEF CARLOS AUGUSTO DE QUEIROZ ROCHA;SANTO AMARO;CIDADE ADEMAR;47,85824511;1;5;2;4,3;4,0;4,0;3,9
13510;EMEF OLINDA MENEZES SERRA VIDAL, PROFA.;GUAIANASES;CIDADE TIRADEN;50,45921942;2;3;3;4,5;4,0;4,4;3,5
16497;EMEF FERNANDO GRACIOSO;PIRITUBA;PERUS;49,34674719;1;3;1;4,4;4,0;4,0;3,9
18546;EMEF DAMIAO, FREI;CAPELA DO SOCORRO;GRAJAU;49,02010064;1;6;2;5;4,0;4,8;3,8
19216;EMEF THEREZA MACIEL DE PAULA PROFA.;SAO MATEUS;SAO RAFAEL;50,00399657;2;6;4;5,1;4,0;4,3;3,6
19219;EMEF ENZO ANTONIO SILVESTRIN, PROF;PIRITUBA;JARAGUA;50,28975155;2;3;3;4,3;4,0;3,9;3,5
19249;EMEF DAISY AMADIO FUJIWARA, PROFA.;BUTANTA;RAPOSO TAVARES;50,44457002;2;3;3;4,9;4,0;3,9;3,6
19269;CEU EMEF PARQUE SAO CARLOS;SAO MIGUEL;VILA JACUI;52,19570918;3;3;5;3,8;4,0;3,7;3,3
19277;CEU EMEF VILA ATLANTICA;PIRITUBA;SAO DOMINGOS;47,86032663;1;5;2;3,8;4,0;4,3;3,3
19362;CEU EMEF VILA DO SOL;CAMPO LIMPO;JARDIM ANGELA;47,26709474;1;6;2;4,3;4,0;4,1;3,0
19390;CEU EMEF JAGUARE;PIRITUBA;JAGUARE;51,0736276;2;3;3;4;4,0;3,6;3,1
19401;EMEF JARDIM FONTALIS;JACANA/TREMEMBE;TREMEMBE;48,2274445;1;3;1;4,4;4,0;4,2;3,4
19436;EMEF CARLOS FRANCISCO GASPAR;CAPELA DO SOCORRO;CIDADE DUTRA;50,45203204;2;3;3;4,8;4,0;4,8;4,3
19465;EMEF AMELIA RODRIGUES DE OLIVEIRA, PROFA;SANTO AMARO;PEDREIRA;47,80039884;1;3;1;4,1;4,0;4,4;4,2
92738;EMEF TARSILA DO AMARAL;BUTANTA;VILA SONIA;48,68328652;1;3;1;4,1;4,0;4,1;2,7
92916;EMEF ANTONIO ESTANISLAU DO AMARAL;CAMPO LIMPO;JARDIM ANGELA;47,49558299;1;5;2;4,6;4,0;4,9;4,1
93513;EMEF JOAO DE LIMA PAIVA, PROF.;GUAIANASES;LAJEADO;50,89176001;2;3;3;5;4,0;4,1;4,0
93556;EMEF FELICIO PAGLIUSO, PROF.;SAO MATEUS;IGUATEMI;46,97808514;1;3;1;3,6;4,0;4,0;2,4
93581;EMEF PLINIO DE QUEIROZ;SAO MATEUS;IGUATEMI;49,97812086;2;3;3;4,3;4,0;4,4;4,7
94242;EMEF ANTONIO PRUDENTE, PROF.;FREGUESIA/BRASILANDIA;BRASILANDIA;48,58002798;1;3;1;3,8;4,0;4,2;3,8
94307;EMEF FREDERICO GUSTAVO DOS SANTOS, TTE. AVIADOR;FREGUESIA/BRASILANDIA;CACHOEIRINHA;49,71516384;2;3;3;4,9;4,0;4,5;4,0
94331;EMEF HUMBERTO DANTAS;FREGUESIA/BRASILANDIA;LIMAO;48,237759;1;3;1;3,5;4,0;3,5;3,6
94609;EMEFM ANTONIO ALVES VERISSIMO;PIRITUBA;JARAGUA;51,32493688;2;5;4;4,9;4,0;4,6;3,6
94927;EMEF MARIA HELENA FARIA LIMA, PROFA.;JACANA/TREMEMBE;VILA MEDEIROS;49,47273329;2;5;4;4,5;4,0;4,4;3,6
95141;EMEF VICENTINA RIBEIRO DA LUZ;ITAQUERA;ARICANDUVA;50,38690768;2;5;4;3,9;4,0;4,3;3,0
95176;EMEF JOSE LINS DO REGO;SAO MATEUS;SAO MATEUS;50,48860278;2;3;3;4,5;4,0;4,0;3,8
97055;EMEF JUSCELINO KUBITSCHEK DE OLIVEIRA, PRES.;GUAIANASES;GUAIANASES;50,24835028;2;3;3;4,1;4,0;3,8;3,5
540;EMEF RAUL POMPEIA;PIRITUBA;JARAGUA;47,33572473;1;5;2;3,9;4,1;3,7;3,2
10413;EMEF QUIRINO CARNEIRO RENNO, PROF.;GUAIANASES;GUAIANASES;49,71029204;2;3;3;4,7;4,1;4,8;3,7
11851;EMEF ANALIA FRANCO BASTOS;PENHA;BELEM;48,30930461;1;3;1;4,8;4,1;4,4;4,4
12157;EMEF ELIAS SHAMMASS;GUAIANASES;CIDADE TIRADEN;52,10054914;3;3;5;3,9;4,1;3,7;3,4
15296;EMEF JOAO FRANZOLIN NETO, PROF.;PENHA;ERMELINO MATAR;50,61250819;2;3;3;4,7;4,1;4,9;4,4
18830;EMEF PAULO FREIRE, PROF.;CAMPO LIMPO;VILA ANDRADE;46,97986555;1;5;2;4;4,1;4,1;3,2
19225;EMEF WANDA OVIDIO GONCALVES, PROFA.;SAO MIGUEL;ITAIM PAULISTA;48,99241907;1;3;1;4,2;4,1;4,3;3,8
19228;EMEF JOSE PEGORARO, PE.;CAPELA DO SOCORRO;GRAJAU;52,60855202;3;3;5;4,3;4,1;4,0;3,8
19272;CEU EMEF PERUS;PIRITUBA;PERUS;51,05580095;2;3;3;4;4,1;4,3;4,2
19388;CEU EMEF ANTONIO CARLOS ROCHA, PROF.;PENHA;PENHA;46,71595432;1;3;1;4,6;4,1;3,8;2,9
19417;EMEF JARDIM PAULO VI;BUTANTA;RAPOSO TAVARES;47,54332627;1;3;1;5;4,1;3,8;3,5
19462;EMEF LILIAN MASO, PROFA;FREGUESIA/BRASILANDIA;BRASILANDIA;48,5169614;1;3;1;4,3;4,1;4,3;3,6
92894;EMEF MARIO MARQUES DE OLIVEIRA, PROF.;CAMPO LIMPO;JARDIM ANGELA;47,22734872;1;6;2;4,5;4,1;4,1;3,9
93611;EMEF RIVADAVIA MARQUES JUNIOR, PROF.;SAO MATEUS;SAO MATEUS;50,56207322;2;3;3;4,5;4,1;5,0;4,0
94471;EMEF LUIZ DAVID SOBRINHO, PROF.;PIRITUBA;JARAGUA;50,50382121;2;3;3;4,9;4,1;4,0;3,6
94544;EMEF RUI BLOEM;PIRITUBA;SAO DOMINGOS;48,87103542;1;3;1;4,5;4,1;4,2;3,5
94811;EMEF ROMAO GOMES, CEL.;JACANA/TREMEMBE;VILA MARIA;47,29536274;1;6;2;3,9;4,1;3,8;3,5
95206;EMEF CALOGERAS, MIN.;SANTO AMARO;CAMPO BELO;48,50742507;1;3;1;4,4;4,1;4,4;3,5
95494;EMEF ARMANDO DE SALLES OLIVEIRA;SAO MATEUS;SAPOPEMBA;49,83774858;2;5;4;4,4;4,1;4,1;3,7
95591;EMEF IVETE VARGAS, DEP.;SAO MATEUS;SAPOPEMBA;50,04537845;2;3;3;4,1;4,1;4,1;2,8
8834;EMEF IDEMIA DE GODOY, PROFA.;GUAIANASES;LAJEADO;49,83151086;2;6;4;3,7;4,2;3,7;4,0
9971;EMEF LUIZ GONZAGA DO NASCIMENTO JR. - GONZAGUINHA;IPIRANGA;SACOMA;48,76078048;1;6;2;4,2;4,2;4,9;2,7
10405;EMEF NILDO DO AMARAL JUNIOR, PE.;SAO MIGUEL;ITAIM PAULISTA;49,02604086;1;3;1;4,3;4,2;3,7;3,9
15440;EMEF EUZEBIO ROCHA FILHO;SAO MIGUEL;VILA CURUCA;48,09890193;1;5;2;4,3;4,2;4,4;3,6
16519;EMEFM RUBENS PAIVA;SAO MATEUS;SAPOPEMBA;49,14013887;1;4;2;4,1;4,2;4,1;3,8
19232;EMEF FAZENDA DA JUTA;SAO MATEUS;SAPOPEMBA;49,87167417;2;3;3;4,3;4,2;3,9;3,7
19257;EMEF ALDO DA TOFORI, PE;SANTO AMARO;PEDREIRA;49,25588921;1;6;2;5;4,2;4,1;4,2
19262;CEU EMEF BUTANTA;BUTANTA;RIO PEQUENO;49,67956526;2;3;3;4,5;4,2;3,8;2,3
19274;CEU EMEF CANDIDA DORA PINO PRETINI, PROFA;SAO MATEUS;SAO RAFAEL;48,5544781;1;4;2;4,6;4,2;4,5;3,4
19276;CEU EMEF TRES LAGOS;CAPELA DO SOCORRO;GRAJAU;50,92031781;2;5;4;4,6;4,2;4,4;4,1
19305;EMEF JOAO DA SILVA;CAPELA DO SOCORRO;GRAJAU;48,99770307;1;3;1;4,4;4,2;4,3;3,4
19347;EMEF JARDIM DA CONQUISTA;PIRITUBA;PERUS;49,6281958;2;3;3;4,8;4,2;4,6;4,1
19349;EMEF JARDIM DAMASCENO I - PROFESSOR JOAO ANTONIO FELICIO;FREGUESIA/BRASILANDIA;BRASILANDIA; - ; - ; - ; -;3,7;4,2;4,1;3,7
19349;EMEF JARDIM DAMASCENO I - PROFESSOR JOAO ANTONIO FELICIO;FREGUESIA/BRASILANDIA;BRASILANDIA;47,6163814;1;3;1;3,7;4,2;4,1;3,7
19350;EMEF JOSE HERMINIO RODRIGUES, CEL. PM;FREGUESIA/BRASILANDIA;BRASILANDIA;47,78728298;1;3;1;4,5;4,2;4,2;3,5
19460;EMEF JOSE CARLOS NICOLETO - ZITO, PROFESSOR;SAO MATEUS;SAO RAFAEL;46,79620404;1;3;1;4,9;4,2;4,2;3,8
19463;EMEF ESTACAO JARAGUA;PIRITUBA;JARAGUA;50,02632091;2;3;3;4,1;4,2;4,6;3,6
19673;EMEF LIA - MARIA DOS REIS DE JESUS SOUZA SILVA, PROFA.;CAPELA DO SOCORRO;GRAJAU;48,51482447;1;3;1;3,9;4,2;-;-
92703;EMEF THEODOMIRO DIAS, DES.;BUTANTA;VILA SONIA;48,94091556;1;3;1;4;4,2;4,4;3,5
92711;EMEF DEODORO DA FONSECA, MAL.;BUTANTA;BUTANTA;52,71586905;3;6;6;5,2;4,2;5,0;4,7
92801;EMEF IBRAHIM NOBRE;BUTANTA;RIO PEQUENO;48,38301996;1;3;1;3,6;4,2;3,6;2,5
93106;EMEF DILERMANDO DIAS DOS SANTOS;PIRITUBA;VILA LEOPOLDIN;48,81426743;1;3;1;4,4;4,2;4,1;3,0
93394;EMEF TEODOMIRO TOLEDO PIZA, DES.;CAPELA DO SOCORRO;GRAJAU;47,00048234;1;6;2;4,3;4,2;4,4;3,4
93602;EMEF RODRIGO MELLO FRANCO DE ANDRADE;SAO MATEUS;SAO MATEUS;50,70822059;2;3;3;4,1;4,2;4,0;3,2
93769;EMEF PEDRO DE FRONTIN, ALM.;SAO MIGUEL;SAO MIGUEL;49,26165012;1;5;2;4,1;4,2;4,4;3,8
93998;EMEF ABRAO DE MORAES, PROF.;PENHA;ARTUR ALVIM;50,07650755;2;3;3;5,3;4,2;4,9;4,1
94234;EMEF THEO DUTRA;FREGUESIA/BRASILANDIA;BRASILANDIA;48,93450122;1;3;1;5,4;4,2;4,5;3,4
94561;EMEF EUCLIDES CUSTODIO DA SILVEIRA, DES.;PIRITUBA;SAO DOMINGOS;52,99358303;3;3;5;4,6;4,2;5,1;5,0
94862;EMEF ALBERTO SANTOS DUMONT;JACANA/TREMEMBE;VILA MEDEIROS;48,98829738;1;3;1;4;4,2;3,5;3,1
95397;EMEF MARLENE RONDELLI, PROFA.;IPIRANGA;SAO LUCAS;49,12979227;1;3;1;4,7;4,2;4,6;4,0
95427;EMEF ALVARES DE AZEVEDO;IPIRANGA;SAO LUCAS;51,10273052;2;3;3;5,5;4,2;5,1;4,2
95508;EMEF BRASILIO MACHADO NETO;SAO MATEUS;SAPOPEMBA;48,24174696;1;3;1;4,3;4,2;3,5;3,2
99791;EMEF PLINIO SALGADO;CAPELA DO SOCORRO;GRAJAU;47,84667081;1;6;2;5,7;4,2;4,6;4,2
8842;EMEF SEBASTIAO FRANCISCO, O NEGRO;ITAQUERA;PARQUE DO CARM;47,99603612;1;3;1;3,9;4,3;4,4;3,3
10103;EMEF FRANCISCO ALVES MENDES FILHO - CHICO MENDES;ITAQUERA;CIDADE LIDER;47,42892631;1;3;1;4,1;4,3;4,2;3,5
12688;EMEF ULYSSES DA SYLVEIRA GUIMARAES;CAPELA DO SOCORRO;PARELHEIROS;49,00085162;1;3;1;4,7;4,3;4,4;3,7
14699;EMEF ANTONIO DAVILA, PROF.;GUAIANASES;CIDADE TIRADEN;51,60186611;2;3;3;4,7;4,3;4,5;4,0
15423;EMEF PRESTES MAIA;SANTO AMARO;CIDADE ADEMAR;49,98871396;2;3;3;4,2;4,3;4,4;4,2
17981;EMEF PERICLES EUGENIO DA SILVA RAMOS;IPIRANGA;IPIRANGA;46,19384001;1;3;1;5,2;4,3;3,6;3,6
19260;CEU EMEF PAULO GONCALO DOS SANTOS, PROF.;SANTO AMARO;PEDREIRA;48,65138495;1;3;1;4,1;4,3;4,2;4,2
19271;CEU EMEF PERA MARMELO;PIRITUBA;JARAGUA;51,994;3;6;6;5,3;4,3;4,6;4,2
19283;EMEF JOSE BLOTA JUNIOR, DEP.;CAMPO LIMPO;JARDIM ANGELA;47,74371556;1;3;1;4,1;4,3;4,0;3,5
19370;EMEF JARDIM MITSUTANI I - PAULO PATARRA, JORNALISTA;CAMPO LIMPO;CAMPO LIMPO;48,72267311;1;3;1;4,1;4,3;4,4;3,8
19391;CEU EMEF ALTO ALEGRE;SAO MATEUS;IGUATEMI;52,99719278;3;3;5;3,9;4,3;3,9;3,6
19443;EMEF MEIRE DE JESUS RIBEIRO,PROF.;GUAIANASES;CIDADE TIRADEN;48,29742547;1;3;1;4;4,3;3,9;3,4
92720;EMEF ARTHUR WHITAKER, DES.;BUTANTA;VILA SONIA;50,12824888;2;5;4;4,7;4,3;4,4;4,1
92827;EMEF ALVARO SILVA BRAGA, GEN.;BUTANTA;RIO PEQUENO;49,25793579;1;3;1;4,5;4,3;3,8;2,9
92860;EMEF MARIO MOURA E ALBUQUERQUE, BEL.;CAMPO LIMPO;JARDIM SAO LUI;47,48939693;1;3;1;4;4,3;4,1;3,6
92932;EMEF JORGE AMERICANO, PROF.;CAMPO LIMPO;CAPAO REDONDO;47,12868231;1;6;2;4,4;4,3;3,7;3,5
92967;EMEF LEVY DE AZEVEDO SODRE, PROF.;CAMPO LIMPO;CAMPO LIMPO;47,63811766;1;3;1;4,4;4,3;4,0;3,5
93084;EMEF DE GAULLE, GEN.;CAMPO LIMPO;JARDIM SAO LUI;46,17718598;1;3;1;4;4,3;3,9;3,5
93289;EMEF PEREIRA CARNEIRO, CDE.;SANTO AMARO;CAMPO GRANDE;52,08636522;3;3;5;4,3;4,3;5,2;4,5
93416;EMEF JOSE AMADEI, ENG.;CAPELA DO SOCORRO;CIDADE DUTRA;50,85449084;2;3;3;4,1;4,3;5,2;4,9
93505;EMEF BENEDITO CALIXTO;ITAQUERA;JOSE BONIFACIO;50,87856278;2;6;4;4,4;4,3;4,4;3,9
93661;EMEF OCTAVIO MANGABEIRA;PENHA;ERMELINO MATAR;47,81418876;1;3;1;5,1;4,3;4,2;3,6
93718;EMEF ANTONIO DUARTE DE ALMEIDA, PROF.;ITAQUERA;ITAQUERA;48,48069858;1;3;1;4,2;4,3;4,0;3,4
93742;EMEF LUIS SAIA, ARQ.;SAO MIGUEL;SAO MIGUEL;51,19758533;2;5;4;4,6;4,3;4,8;4,9
93785;EMEF JOAO RIBEIRO DE BARROS;GUAIANASES;LAJEADO;48,92234864;1;6;2;4,3;4,3;4,8;3,6
93793;EMEF JOSE DE ANCHIETA, PE.;SAO MIGUEL;SAO MIGUEL;48,5734537;1;3;1;4,4;4,3;4,2;3,1
93891;EMEF ARMANDO CRIDEY RIGHETTI;SAO MIGUEL;JARDIM HELENA;46,24983724;1;3;1;3,8;4,3;3,6;3,3
94218;EMEF ANDRE RODRIGUES DE ALCKMIN, PROF.;FREGUESIA/BRASILANDIA;BRASILANDIA;49,38137846;2;3;3;3,9;4,3;4,1;3,1
94820;EMEF JOAO DOMINGUES SAMPAIO;JACANA/TREMEMBE;VILA MARIA;49,2730699;1;3;1;5;4,3;4,9;4,5
94951;EMEF SHIRLEY GUIO, PROFA.;JACANA/TREMEMBE;VILA MEDEIROS;50,98130645;2;3;3;5,3;4,3;4,4;3,9
95028;EMEF JOSE DO PATROCINIO;IPIRANGA;SACOMA;52,35988903;3;3;5;4,7;4,3;4,4;4,1
95567;EMEF ALCEU AMOROSO LIMA;SAO MATEUS;SAO RAFAEL;47,79574709;1;3;1;4,1;4,3;4,2;3,5
95605;EMEF VILANOVA ARTIGAS, ARQ.;SAO MATEUS;SAPOPEMBA;48,76904434;1;5;2;4,2;4,3;4,2;3,6
302;EMEF HELIO FRANCO CHAVES, CEL.;JACANA/TREMEMBE;TREMEMBE;48,30293374;1;5;2;5,4;4,4;5,5;4,5
311;EMEF ANTONIO ALVES DA SILVA, SG.;CAMPO LIMPO;CAPAO REDONDO;50,29245808;2;5;4;4,6;4,4;4,5;3,9
10049;EMEF CHICO FALCONI, PE.;SAO MIGUEL;VILA CURUCA;49,5024288;2;3;3;4,2;4,4;4,2;3,4
10138;EMEF ELZA MAIA COSTA FREIRE, PROFA.;SANTO AMARO;CIDADE ADEMAR;53,6048788;3;5;6;4,5;4,4;4,2;3,8
12874;EMEF BENEDITO DE JESUS BATISTA LAURINDO - PE BATISTA;SAO MATEUS;SAPOPEMBA;49,18536536;1;5;2;3,8;4,4;4,1;3,4
19241;EMEF HELLIO TAVARES, DR.;SAO MIGUEL;ITAIM PAULISTA;49,57840757;2;3;3;4,4;4,4;4,3;4,1
19243;EMEF MARINA MELANDER COUTINHO, PROFA;CAPELA DO SOCORRO;CIDADE DUTRA;50,24563062;2;3;3;4,6;4,4;4,5;4,1
19261;CEU EMEF PAULO GOMES CARDIM, PROF. DR.;ITAQUERA;CIDADE LIDER;50,59460281;2;5;4;5,5;4,4;4,3;3,6
19264;CEU EMEF INACIO MONTEIRO;GUAIANASES;CIDADE TIRADEN;49,03322336;1;5;2;4;4,4;3,8;3,4
19266;CEU EMEF MENINOS;IPIRANGA;SACOMA;48,98072981;1;3;1;4,9;4,4;4,5;3,9
19395;EMEF NEIR AUGUSTO LOPES, PROF;FREGUESIA/BRASILANDIA;CACHOEIRINHA;48,39124883;1;3;1;4,1;4,4;4,4;4,0
19409;EMEF IZABEL APARECIDA CRISTOVAO DA LUZ, PROFA;SAO MIGUEL;ITAIM PAULISTA;49,11501629;1;3;1;3,8;4,4;4,1;3,5
19440;EMEF GENY MARIA MUNIZ ALMEIDA KLEIN PUSSINELLI, PROFA.;CAPELA DO SOCORRO;CIDADE DUTRA;50,82155769;2;3;3;4,7;4,4;4,8;3,9
19455;EMEF CELIA REGINA ANDERY BRAGA, PROF;GUAIANASES;CIDADE TIRADEN;49,99967471;2;3;3;4,8;4,4;4,5;3,6
19456;EMEF HELINA COUTINHO LOURENCO ALVES, PROFESSORA;GUAIANASES;CIDADE TIRADEN;49,33333449;1;3;1;4,8;4,4;4,6;3,8
19487;EMEF CHACARA TURISTICA;PIRITUBA;JARAGUA;48,85284714;1;3;1;4,7;4,4;4,1;3,2
19585;EMEF WLADIMIR DE TOLEDO PIZA,PREF.;SAO MATEUS;IGUATEMI;50,30191004;2;3;3;4,1;4,4;4,6;4,4
19674;CEU EMEF JARDIM ELIANA;CAPELA DO SOCORRO;GRAJAU;48,13949411;1;5;2;4,5;4,4;4,1;3,9
92797;EMEF JULIO MESQUITA;BUTANTA;BUTANTA;53,60538224;3;3;5;5,2;4,4;5,0;4,1
92886;EMEF OLIVEIRA VIANA;CAMPO LIMPO;JARDIM ANGELA;47,62329417;1;6;2;3,9;4,4;4,4;3,3
92959;EMEF IRACEMA MARQUES DA SILVEIRA, PROFA.;CAMPO LIMPO;CAPAO REDONDO;47,95992969;1;6;2;4;4,4;4,4;3,4
93025;EMEF PALIMERCIO DE REZENDE, CEL.;CAMPO LIMPO;CAMPO LIMPO;48,6938637;1;3;1;5,4;4,4;4,1;3,1
93211;EMEF JOAO GUALBERTO DO AMARAL CARVALHO;SANTO AMARO;CAMPO GRANDE;53,1288016;3;3;5;5;4,4;4,6;4,0
93297;EMEF PLACIDO DE CASTRO;CAPELA DO SOCORRO;SOCORRO;52,93763519;3;3;5;5,3;4,4;4,4;3,9
93530;EMEF JOANA ANGELICA DE JESUS, MADRE;GUAIANASES;GUAIANASES;49,807224;2;3;3;5;4,4;4,2;4,0
93564;EMEF JOAQUIM OSORIO DUQUE ESTRADA;SAO MATEUS;IGUATEMI;49,50647734;2;3;3;5;4,4;4,8;4,3
93645;EMEF MAURICIO GOULART;GUAIANASES;CIDADE TIRADEN;50,71638328;2;3;3;4;4,4;3,9;3,3
93696;EMEF EPITACIO PESSOA, PRES.;SAO MIGUEL;VILA JACUI;49,76501959;2;5;4;5;4,4;4,8;4,6
93726;EMEF PEDRO TEIXEIRA;SAO MIGUEL;VILA JACUI;49,20259988;1;3;1;4,2;4,4;4,5;3,6
93815;EMEF ALEXANDRE DE GUSMAO;GUAIANASES;LAJEADO;49,9643132;2;3;3;5,2;4,4;4,1;3,7
94030;EMEF ARTHUR ALVIM;PENHA;ARTUR ALVIM;50,05904199;2;3;3;6,2;4,4;4,6;3,9
94056;EMEF JENNY GOMES, DA.;PENHA;ARTUR ALVIM;50,16632702;2;5;4;4,5;4,4;4,3;4,0
94064;EMEF 8 DE MAIO;ITAQUERA;ITAQUERA;53,3391903;3;3;5;4,5;4,4;4,3;3,5
94137;EMEF CECILIA MEIRELES;PENHA;CANGAIBA;48,39821432;1;5;2;4,7;4,4;4,6;4,3
94374;CEU EMEF TEOTONIO VILELA, SEN.;FREGUESIA/BRASILANDIA;BRASILANDIA;51,07363203;2;3;3;3,9;4,4;3,8;3,0
94391;EMEF MARIO KOSEL FILHO;PIRITUBA;PIRITUBA;51,12752692;2;3;3;4,5;4,4;5,2;3,9
94455;EMEF VICENTE DE PAULO DALE COUTINHO, GEN.;PIRITUBA;JARAGUA;47,72040074;1;6;2;4,5;4,4;4,3;3,7
94706;EMEF GASTAO MOUTINHO, CTE.;JACANA/TREMEMBE;MANDAQUI;53,0356172;3;3;5;4,2;4,4;4,5;4,2
94722;EMEF JOAO RAMOS - PERNAMBUCO - ABOLICIONISTA;JACANA/TREMEMBE;TREMEMBE;50,17236545;2;3;3;4,5;4,4;4,1;4,1
95231;EMEF MARINA VIEIRA DE CARVALHO MESQUITA;SANTO AMARO;JABAQUARA;50,58863192;2;3;3;4,6;4,4;4,4;3,8
95320;EMEF IRINEU MARINHO;IPIRANGA;VILA PRUDENTE;48,71466655;1;3;1;4,2;4,4;3,9;3,2
95541;EMEF OLIVAL COSTA;SAO MATEUS;SAPOPEMBA;49,90539596;2;3;3;5,3;4,4;5,2;4,2
97047;EMEF EDUCANDARIO DOM DUARTE, ANEXA AO;BUTANTA;RAPOSO TAVARES;51,09578941;2;3;3;4,8;4,4;4,8;3,6
97063;EMEF ANTONIO PEREIRA IGNACIO;GUAIANASES;CIDADE TIRADEN;47,73444038;1;3;1;4,1;4,4;4,0;3,8
99091;EMEF HIPOLITO JOSE DA COSTA;JACANA/TREMEMBE;TREMEMBE;48,56789741;1;6;2;4,3;4,4;4,5;3,7
99139;EMEF VIRGILIO DE MELLO FRANCO;SAO MIGUEL;JARDIM HELENA;48,19365724;1;5;2;4,4;4,4;4,0;4,1
99651;EMEF JOSE HONORIO RODRIGUES;SAO MIGUEL;VILA CURUCA;50,29298501;2;3;3;4,3;4,4;4,6;4,2
10111;EMEF MARIO SCHENBERG, PROF.;SANTO AMARO;PEDREIRA;49,08235527;1;3;1;4,1;4,5;4,6;3,5
19195;EMEF JOSE KAUFFMANN , DR.;PIRITUBA;JARAGUA;49,69018269;2;5;4;4,4;4,5;4,1;3,0
19265;CEU EMEF JAMBEIRO;GUAIANASES;LAJEADO;50,25802128;2;5;4;4,1;4,5;4,0;3,6
19267;EMEF MARIA RITA DE CASSIA PINHEIRO SIMOES BRAGA, PROFA.;CAMPO LIMPO;CAPAO REDONDO;46,73837643;1;3;1;3,7;4,5;4,1;3,5
19275;EMEF FRANCISCO REBOLO;CAMPO LIMPO;VILA ANDRADE;47,99294802;1;3;1;4,8;4,5;4,5;3,8
19337;CEU EMEF JACANA;JACANA/TREMEMBE;JACANA;49,75058366;2;3;3;3,9;4,5;4,3;3,6
19373;CEU EMEF JOSE REZENDE, PROF.;SANTO AMARO;JABAQUARA;48,4195378;1;3;1;4,5;4,5;4,0;3,4
19389;CEU EMEF VALTER PAULINO ESTEVAM, PROF. DR.;PIRITUBA;ANHANGUERA;47,91508526;1;3;1;5,2;4,5;4,5;3,6
19398;EMEF AGUAS DE MARCO;ITAQUERA;JOSE BONIFACIO;51,19263686;2;3;3;4,8;4,5;5,1;4,5
19414;EMEF MOISES ELIAS DE SOUZA, TTE.;PIRITUBA;JARAGUA;49,32613856;1;3;1;5,1;4,5;4,3;3,1
19416;EMEF VILA MUNCK;BUTANTA;RAPOSO TAVARES;52,33114742;3;3;5;4,8;4,5;5,3;4,7
19421;EMEF JOSE FRANCISCO CAVALCANTE, PROF;CAMPO LIMPO;CAPAO REDONDO;52,167972;3;3;5;4,6;4,5;4,5;4,1
19434;EMEF CAMPO LIMPO II;CAMPO LIMPO;CAPAO REDONDO;48,31310722;1;3;1;4,6;4,5;3,9;3,3
19454;EMEF BARTOLOMEU CAMPOS DE QUEIROS;SAO MATEUS;SAPOPEMBA;48,79589469;1;3;1;4,4;4,5;4,2;3,7
19500;EMEF HERBERT DE SOUZA - BETINHO;CAMPO LIMPO;CAPAO REDONDO;49,04056938;1;5;2;4,5;4,5;4,5;4,6
19529;EMEF JARDIM SILVA TELES;SAO MIGUEL;VILA CURUCA;50,40324842;2;3;3;4,5;4,5;3,6;3,0
19551;CEU EMEF CESAR ARRUDA CASTANHO, DEP.;BUTANTA;RAPOSO TAVARES;48,30110885;1;3;1;4,3;4,5;4,0;4,1
19607;EMEF ANTONIO RODRIGUES DE CAMPOS, PROF.;PIRITUBA;JARAGUA;50,07666237;2;3;3;4,2;4,5;3,8;3,5
91804;EMEF PAULO NOGUEIRA FILHO;FREGUESIA/BRASILANDIA;CASA VERDE;51,91753594;3;3;5;5,1;4,5;4,8;4,2
92908;EMEF CLEMENTE PASTORE, PROF.;CAMPO LIMPO;JARDIM ANGELA;49,12892941;1;6;2;4;4,5;3,9;3,2
92941;EMEF EUCLIDES DA CUNHA;CAMPO LIMPO;CAPAO REDONDO;52,33627759;3;3;5;4,1;4,5;4,8;3,5
92983;EMEF PROCOPIO FERREIRA;CAMPO LIMPO;JARDIM SAO LUI;51,17928316;2;5;4;3,8;4,5;3,9;3,5
92991;EMEF AIRTON ARANTES RIBEIRO, PROF.;CAMPO LIMPO;JARDIM SAO LUI;49,66960402;2;5;4;4,7;4,5;5,1;3,7
93009;EMEF LUIZ TENORIO DE BRITO, CEL.;CAMPO LIMPO;JARDIM SAO LUI;53,17836624;3;3;5;4,7;4,5;5,2;4,4
93050;EMEF SYNESIO ROCHA, MIN.;CAMPO LIMPO;CAMPO LIMPO;51,12675589;2;5;4;4,8;4,5;4,3;4,2
93076;EMEF PAULO COLOMBO PEREIRA DE QUEIROZ, DES.;CAMPO LIMPO;CAMPO LIMPO;48,84493789;1;6;2;4,9;4,5;4,5;3,5
93467;EMEF DANYLO JOSE FERNANDES;ITAQUERA;CIDADE LIDER;49,26496743;1;3;1;3,9;4,5;3,8;3,5
93572;EMEF COELHO NETO;SAO MATEUS;IGUATEMI;49,78647464;2;6;4;4,6;4,5;4,5;3,3
93807;EMEF JOAO AUGUSTO BREVES, DR.;SAO MIGUEL;SAO MIGUEL;51,81304127;3;3;5;4,8;4,5;4,5;4,3
93866;EMEF RAIMUNDO CORREIA;SAO MIGUEL;JARDIM HELENA;50,5482451;2;3;3;4,7;4,5;4,6;4,4
93904;EMEF CAPISTRANO DE ABREU;SAO MIGUEL;JARDIM HELENA;49,0508868;1;6;2;5,2;4,5;4,5;3,5
94129;EMEF GUILHERME DE ALMEIDA;PENHA;CANGAIBA;51,63074352;2;3;3;4,9;4,5;4,6;4,2
94579;EMEF JOSE FERRAZ DE CAMPOS, PROF.;PIRITUBA;JAGUARA;52,02818713;3;5;6;4,6;4,5;4,9;3,9
94641;EMEF ESPACO DE BITITA;PENHA;PARI; - ; - ; - ; - ;4,2;4,5;4,4;3,3
94641;EMEF ESPACO DE BITITA;PENHA;PARI;46,90406875;1;5;2;4,2;4,5;4,4;3,3
94684;EMEF MARCOS MELEGA;JACANA/TREMEMBE;MANDAQUI;49,30446824;1;3;1;4,8;4,5;4,8;4,4
